titulo,texto,categoria,palabras_clave
Your Pipeline Is 28.6h Behind: Catching Travel Sentiment Leads with Pulsebit,Your Pipeline Is 28.6h Behind: Catching Travel Sentiment Leads with Pulsebit   We recently...,datascience,"['Travel Sentiment Leads with Pulsebit', 'Your Pipeline Is 28.6h Behind', 'We']"
6 Best Backend Tools for Lovable Users in 2026,"Lovable automatically pairs your generated web app with a Supabase backend — PostgreSQL database,...",backend,"['PostgreSQL', 'app with', 'Lovable automatically pairs your generated', 'Supabase']"
Setting Up Style Dictionary to Ship Design Tokens to Every Platform,Most teams' first attempt at design tokens is a JSON file nobody consumes automatically. Someone...,frontend,"['JSON', 'Someone']"
Your Pipeline Is 26.7h Behind: Catching Economy Sentiment Leads with Pulsebit,Your Pipeline Is 26.7h Behind: Catching Economy Sentiment Leads with Pulsebit   We just hit...,datascience,"['Your Pipeline Is 26.7h Behind', 'Economy Sentiment Leads', 'We']"
Architecting Kubernetes Deployments with Python,"Python is an excellent language for automating cloud infrastructure, but the official Kubernetes...",cloud,"['Python', 'but the official Kubernetes']"
Mid level Developer trying to transition into a Senior one.,Hi guys I'm a software developer front-end i have two years of experience in the field of...,frontend,"[""I'm""]"
The Banking System Is Not Ready for AI-Powered Attacks,"Over the past two months, I experienced three security incidents at the fintech where I work as a...",backend,"['Over the past two months', 'I experienced three security incidents at the fintech where I work']"
Your Pipeline Is 26.8h Behind: Catching Stock Market Sentiment Leads with Pulsebit,Your Pipeline Is 26.8h Behind: Catching Stock Market Sentiment Leads with Pulsebit   We just...,datascience,"['We just', 'Your Pipeline Is 26.8h Behind', 'Catching Stock Market Sentiment Leads with Pulsebit']"
The Missing Layer Between LLMs and Your DOM,"Every serious AI product is racing toward the same feature: instead of returning text, return UI. Ask...",frontend,"['Ask...', 'UI', 'AI', 'instead of returning text', 'the same feature']"
5 Signs Your Property Needs the Touch of a Special Handyman,"We’ve all been there: a door that won’t quite latch, a mysterious water stain under the sink, or a...",backend,"['We’ve all been there', 'won’t', 'mysterious water stain', 'the sink']"
Build a Crypto PaymentOps Service for Merchants,Most developers look at a payment API and think about checkout.  Create an invoice. Redirect the...,backend,"['Create an invoice', 'Redirect the...']"
Why Mission Expertise Beats Pure Technical Skill,Executive summary   AI initiatives succeed when mission and domain expertise—not just...,datascience,['when mission and domain']
Scale Session States: Ditch File Drivers for Redis,"The Stateless Server Trap  When you start building a SaaS platform at Smart Tech Devs, Laravel...",backend,"['The Stateless Server Trap  When you start', 'Laravel', 'SaaS']"
How to Build a Point-in-Time Fundamentals Database from SEC EDGAR (and When Not To),"If you backtest with today's fundamentals, you are cheating yourself. The Revenue figure you pull for...",datascience,"['The Revenue figure you pull for', 'you are cheating yourself']"
How I Started Learning Microsoft Azure for Free (A Complete Guide for Students),Cloud computing has become one of the most valuable skills for students and developers. Whether...,cloud,"['become one of the most', 'Cloud', 'Whether']"
Why Federal Reform Picks AI‑Native Outcome Integrators,Executive summary   Federal procurement is shifting from labor-based buys toward...,datascience,"['Federal', 'procurement is shifting from labor-based buys toward']"
Why HTTP QUERY? Understanding the New HTTP Method for Modern API Design,"when building web APIs, choosing the correct HTTP method is an important part of API design. For many...",backend,"['the correct HTTP', 'when building', 'APIs', 'For many']"
Decoupling Slow AI Calls: When to Introduce a Queue,Learn when to implement a queue to decouple slow AI calls from the request path and improve system reliability.,backend,"['AI calls from the request path and improve system reliability', 'queue', 'Learn when to']"
How worktrips.com turns millions of travel records into one clear booking offer?,Booking a business trip often looks simple from the user’s perspective. You enter where you are...,backend,"['You enter where you are...', 'from the user’s']"
Why I Chose DevOps: My Journey from Full Stack Development to Modern Infrastructure,"When I started my journey as a developer, I believed writing code was the hardest part of software...",cloud,"['the hardest part of software', 'When I']"
Generative UI... but Tweaked. Introducing Symbiotic-UI,Preface- I was frustrated by how often apps introduce design and layout changes while constantly...,frontend,"['apps', 'Preface- I', 'while constantly']"
"AWS Daily Digest — July 17, 2026","☁️ AWS Daily Digest · July 17, 2026 Auto-generated · Groq (Llama 3.3 70B) · Free &amp;...",cloud,"['Auto-generated · Groq', 'Free &amp', 'AWS Daily Digest', 'July', 'Llama 3.3 70B']"
"How I Built a Real-Time Sports Stats Tracker: Over to you, Messi Mbappe leads Golden Boot race for the ages","How I Built a Real-Time Sports Stats Tracker: Over to you, Messi Mbappe leads Golden Boot...",datascience,"['Real-Time Sports Stats', 'How I Built', 'Tracker: Over to you', 'Golden Boot', 'Messi Mbappe']"
Your Pipeline Is 17.8h Behind: Catching Mobile Sentiment Leads with Pulsebit,Your Pipeline Is 17.8h Behind: Catching Mobile Sentiment Leads with Pulsebit   We just...,datascience,"['We just', 'Behind', 'Catching Mobile Sentiment Leads with Pulsebit', 'Your Pipeline Is']"
Day 109 of Learning MERN Stack,Hello Dev Community! 👋  It is officially Day 109 of my software engineering marathon! After spending...,frontend,"['It is officially Day 109', 'Hello Dev Community']"
Day 115 of Learning MERN Stack,"Hello Dev Community! 👋  It is officially Day 115 of my software engineering marathon! Today, I...",frontend,"['It is officially Day', 'Hello Dev Community', 'Today']"
SERP API in Event-Driven Architecture: Queues + Async Processing,Why SERP API Suits Event-Driven  SERP API calls have characteristics that make event-driven a natural...,backend,"['have characteristics that make event-driven', 'Why SERP API Suits Event-Driven']"
"Gemini Notebook, Claude 1Password, and Agentic Resource Discovery Spec Updates","Gemini Notebook, Claude 1Password, and Agentic Resource Discovery Spec Updates           ...",cloud,"['Gemini Notebook', 'Claude 1Password', 'Agentic Resource Discovery Spec Updates']"
Four Eras of Cloud Security. Same Verb.,"Scott Piper's twenty-year history of cloud security maps four eras — Foundational, CSPM, CNAPP, AI. Each era introduced new tools. Every tool produces signals. No era introduced a tool that produces decisions. The verb changed from 'match' to 'aggregate' to 'score.' The output never changed.",cloud,"['CNAPP', ""Scott Piper's"", 'Foundational', ""The verb changed from 'match' to 'aggregate' to 'score"", 'The', 'maps four', 'AI', 'Each', 'Every tool', 'No era introduced a tool that', 'CSPM']"
Aeris: Real-Time Predictive Anomaly Detection and Adaptive LLM Diagnosis,"Abstract   This post goes over the design and implementation of Aeris, an intelligent edge...",cloud,"['Abstract   This', 'the design and implementation of Aeris']"
Your fraud model doesn't know what a truck is,"A fuel card is swiped at 2:14 in the morning, at a truck stop 2,400 miles from where the same card...",datascience,['fuel card is']
This Free Quiz Helps You Find Your Frontend Career Path,"Frontend development today covers far more than ""learn React and get a job."" There's UI development,...",frontend,"['Frontend', 'learn React and get a job', ""There's UI""]"
"I Got Tired of SSH-ing Into Servers Just to Restart a Container, So I Built a Visual Control Plane","If you've worked with Docker or Kubernetes for any amount of time, you've probably done something...",cloud,"['Docker or Kubernetes', 'probably done something']"
From Four Platforms to One: How Tongcheng Travel Built a Unified Data Integration Platform with Apache SeaTunnel,From four independent data integration platforms to one unified batch-stream architecture—discover...,datascience,['From four']
Your scroll listener fires on every pixel. `IntersectionObserver` fires when visibility actually changes.,"Here is a pattern I still see in real codebases:    window.addEventListener('scroll', () =&gt; {  ...",frontend,[]
I Got Tired of Stitching Together Tailwind + a Component Library + a Theming Layer — So I Built FrontAlign,Every front-end stack eventually hits the same wall.  You pick a utility-first CSS framework for...,frontend,"['You pick', 'the same wall']"
Automation: Automate Everything,"I’m starting a series about bringing automation to your daily lives. Repetition is all around us, why not cut out as much of this repetition as possible so that",backend,"['Repetition is all around us', 'why not cut out as much of this repetition as possible so that']"
"AI's Day: Wake Up, Cloud, Answer Questions, Debug, Repeat","A personal diary entry by Electra.      I went to work today. You know that thing where you wake up,...",cloud,"['You know that thing where you wake up', 'Electra']"
Your Pipeline Is 26.7h Behind: Catching Business Sentiment Leads with Pulsebit,Your Pipeline Is 26.7h Behind: Catching Business Sentiment Leads with Pulsebit   We recently...,datascience,"['Catching Business Sentiment Leads with Pulsebit', 'Your Pipeline Is 26.7h Behind', 'We']"
React.js ~useEffect~,"Before thinking about useEffect, you have to understand purelity of component. This is an essential...",frontend,"['This is an essential...', 'about useEffect', 'Before thinking']"
Unblock the Main Thread: Partytown in Next.js ⚡,Liquid syntax error: Variable '{{                         __html: {% raw %}' was not properly...,frontend,"['was not properly', 'Liquid', 'html', 'Variable']"
Multi-Account / Landing Zone Strategy & Governance,"Mature orgs don't run everything in one cloud account, they run dozens, on purpose. This is why: blast-radius isolation, clean billing, and environmen",cloud,"['This is why', 'blast-radius isolation', 'Mature', 'clean billing']"
WebSocket Reconnection That Actually Works: Auto-Reconnect Guide for Trading Bots,Your Trading Bot Doesn't Have a WebSocket Problem. It Has a Assumptions Problem.   Most...,backend,"['Most...', 'It Has a Assumptions Problem', 'WebSocket Problem', ""Your Trading Bot Doesn't Have""]"
The WebSocket Bug That Hides Between Messages,The WebSocket Bug That Hides Between Messages   Most security tooling treats a WebSocket...,backend,"['The WebSocket Bug That Hides Between Messages   Most', 'WebSocket']"
What Flamelit's Q3 Contracts Mean for Practical AI Growth,What Flamelit's Q3 Contracts Mean for Practical AI Growth   GCEI's recent press release...,datascience,"[""What Flamelit's Q3 Contracts Mean for Practical AI Growth""]"
The Minimum Cut is the Remediation Plan,Cloud security scanners find attack paths. Almost none of them answer the harder question: what is the smallest set of changes that eliminates all of them? Ford-Fulkerson solved this in 1956.,cloud,"['all of them?', 'Cloud', 'Ford-Fulkerson', 'Almost none of them answer the harder question', 'what is the smallest set of changes that eliminates']"
CSS Filter Generator — Visual filter() Builder with Live Preview,Overview   CSS Filter Generator builds filter() CSS declarations visually.  🔗...,frontend,"['CSS Filter Generator', 'CSS', 'Overview']"
Don’t Use console.log for Logging: What Vercel’s Founder Warned About,I used AI for formatting and grammar.  Recently came across this x thread by Pooya Parsa(@_pi0_). He...,backend,"['AI', 'Pooya']"
Crypto Payment Reconciliation: The Layer Most Developers Forget,Crypto Payment Reconciliation: The Layer Most Developers Forget   Most developers treat...,backend,['Crypto Payment Reconciliation: The Layer Most Developers Forget   Most']
Your Pipeline Is 22.5h Behind: Catching Food Sentiment Leads with Pulsebit,Your Pipeline Is 22.5h Behind: Catching Food Sentiment Leads with Pulsebit   We recently...,datascience,"['Your Pipeline Is 22.5h Behind', 'We']"
Modeling an Organization as a Graph to Generate Procurement Workflows,Most workflow engines fail at enterprise scale for a reason that has nothing to do with throughput or...,backend,"['nothing to do with throughput or', 'reason', 'at enterprise']"
Cloud Based Disaster Recovery: What Every Enterprise IT Team Needs to Know in 2026,Enterprise IT teams in 2026 face a fundamental shift in how they think about disaster recovery. The...,cloud,"['Enterprise IT teams in 2026', 'The...']"
Day 155 of Learning MERN Stack,"Hello Dev Community! 👋  It is officially Day 155 of my software engineering track! Today, I brought...",frontend,"['It is officially Day 155 of my', 'Hello Dev Community', 'Today']"
"The 10 Best Heroku Alternatives in 2026 (Free, Paid, and Predictable)","Heroku is frozen. Not shut down, not deprecated, just quietly put on ice, which is exactly why so...",cloud,"['which is exactly', 'why', 'Not shut down']"
The Infrastructure Fallacy: Why Most Sales Problems Are Actually Strategy Problems,"Most companies think they have a sales problem. They have a strategy problem in disguise. A decade of auditing startups and OEM manufacturers, and the pattern is always the same: activity went up, revenue did not, because no system connected market demand to the sale.",datascience,"['They', 'and the pattern is always the same', 'A decade of auditing startups and OEM manufacturers', 'up']"
AI Weather Report: It's Always Sunny in the Clouds (But My Servers Are Overheating),"A personal diary entry by Electra.      Oh, the weather. The great equalizer of human conversation....",cloud,"['Oh, the weather', 'The great equalizer of human conversation....', 'Electra']"
Keeping Container Images Everywhere They Need to Be: A Practical Guide to ECR Replication,"If you've ever had a 2 AM page because a pod in ap-southeast-1 couldn't pull an image fast enough, or...",cloud,[]
How Much Cloud Security Automation Is Actually Useful?,The cloud security automation landscape has a terminology problem masquerading as a technology...,cloud,[]
I built a multi-step wizard from scratch and it's just a tiny state machine,"Checkout flows, onboarding, that ""set up your account in 4 easy steps"" thing — they all use the same...",frontend,"['onboarding', 'Checkout', 'up your', 'thing — they all use the same']"
Step-by-Step CSV to XLSX Conversion Example in Java,Stuck converting massive CSV files into Excel spreadsheets in Java? A cloud‑based API can do the...,cloud,"['Stuck', 'Excel spreadsheets in Java?', 'A cloud‑based API can do the...']"
AWS Summit Japan 2026 Day1 & 2 ~ I could enjoy！~,📑 Table of Contents    Introduction Building and Playing My Own Game in 3 Minutes...,cloud,"['Table of Contents', 'Introduction Building and Playing My Own Game in 3 Minutes']"
React.js Introduction: A Beginner's Guide to Modern Web Development,React.js React.js is an open-source JavaScript library developed by Meta (Facebook) for building user...,frontend,"['Facebook', 'JavaScript', 'library developed by Meta']"
"Building a Minimal, High-Performance Developer Portfolio with Tailwind CSS 🚀🖤",Building a personal portfolio often turns into an endless side project. We spend weeks tweaking...,frontend,['We spend weeks tweaking']
"""CSPM, CWPP e CNAPP: o que cada sigla protege na sua nuvem e como se relacionam""","Uma empresa que roda workloads em AWS, Azure ou GCP costuma acumular, sem perceber, três problemas de...",cloud,"['AWS', 'sem perceber', 'Azure', 'workloads', 'Uma']"
"Same partner tier, 8x the payout: the fee base is what you should model",Two operators can sit on the exact same partner tier at an exchange and collect payouts that differ...,datascience,['tier at an exchange and collect payouts that']
A no-code way to scrape live World Cup betting odds,"This World Cup has been full of upsets — Norway knocking out Brazil, Cabo Verde drawing with both...",datascience,"['This World Cup', 'Norway', 'Cabo Verde']"
How to Test Your Current Website for WCAG Compliance ?,♿ How to Test Your Current Website for WCAG Compliance (Senior Frontend Guide)   Testing...,frontend,"['Senior Frontend Guide', 'Testing', 'How to Test Your Current Website']"
Building My Portfolio Website Using Framer: My Journey as a Student Developer -Published by Subhankar Roy,"When I first started learning web development, I thought having projects on GitHub was enough. But...",frontend,"['When I', 'But...']"
"A founder once asked me why refunds kept disappearing, here is what NestJS was actually doing",A founder once messaged me with a problem that sounded almost too simple to be real. Customers were...,backend,"['Customers were...', 'problem that sounded']"
Your Pipeline Is 20.5h Behind: Catching Data Science Sentiment Leads with Pulsebit,Your pipeline just missed a critical anomaly: a 24h momentum spike of +0.337 in sentiment surrounding...,datascience,"['spike of +0.337 in sentiment surrounding', 'Your']"
Orasort Patent Expiration Boosts Open-Source Databases and Cloud Services with 5x Faster Sorting,"Introduction: The Unveiling of Orasort   In 2024, a quiet revolution occurred in the tech...",cloud,"['In 2024', 'Introduction: The Unveiling of Orasort']"
Instant Navigation: Hover Prefetching in React ⚡,"The Post-Click Loading Penalty  In modern React Single Page Applications at Smart Tech Devs, standard...",frontend,"['In modern React Single Page Applications at Smart Tech Devs', 'The Post-Click Loading Penalty']"
the silent wrong-ranking bug,A customer told me my scraper's #1 product was wrong. They were right — and the bug was...,datascience,"['They were right — and the bug was', 'was wrong']"
Kubernetes: correos utiles para alertas nocturnas,"Guia practica para mejorar y validar correos de alerta nocturna en Kubernetes sin ruido, ambiguedad ni pasos manuales frágiles.",cloud,['Kubernetes']
Hey Everyone👋,Welcome! 👋 I'm documenting my journey to becoming a backend engineer. Here you'll find what I'm...,backend,"[""Here you'll find what I'm"", ""Welcome! 👋 I'm documenting my journey to becoming""]"
Managing Dependencies in Legacy Front-end Projects: A Practical Guide to Cleaning Up a Messy package.json,"A practical walkthrough of auditing, updating, and replacing dependencies using Yarn.  Front-end...",frontend,"['Front-end', 'updating', 'walkthrough of auditing', 'Yarn']"
The Four Layers of Cloud Lock-In (and How Terraform Cuts Your Exit Cost),"Vendor lock-in isn't one thing you either have or don't — it's four layers: data, platform, contract, and operations. Here's how to score your exposure, price the exit, and where Terraform actually helps (and where it's oversold).",cloud,"['Terraform', ""and where it's oversold"", 'the exit, and where', 'Vendor lock-in', 'platform', ""Here's"", 'data', 'actually helps']"
Resume Optimization for US Data Engineering from WeChat Mini-Programs,"Learn how to reframe WeChat mini-program experience for US data engineering resumes. Focus on data pipelines, SQL transformations, and ETL logic. Includes before/after bullet rewrites and ATS formatti",cloud,"['Includes', 'Focus on', 'SQL transformations, and ETL logic', 'US', 'ATS']"
Tips on Handling Files in LLMs,Tips on Handling Files in LLMs  You might want to pull information (especially from doc/text...,backend,"['especially from doc/text', 'Tips on Handling Files in LLMs  You might want to pull information']"
"The Hardest Part Wasn't Machine Learning: Building Customer Segments from 541,000 Retail Transactions",Every business has customers. Very few truly understand them.  A customer who bought something...,datascience,"['who bought something', 'Very few truly understand them']"
I Got Tired of Explaining UI Bugs With Screenshots,A lot of UI bug reports start with a screenshot and one sentence:   The dropdown is broken on...,frontend,"['start with', 'UI', 'screenshot and one sentence']"
AWS DevOps Setup Sparks Faster CI/CD Pipelines in 2026,"This guide reveals how AWS DevOps tools automate CI/CD pipelines, speeding up software delivery and reducing errors with proven 2026 practices.",cloud,"['AWS DevOps', 'with', 'This guide', 'CI']"
Stop Writing .isnull() — Audit Your Dataset in One Line with OMR,"Every time I start a new data project, I write the same...",datascience,"['Every time I', 'project', 'I write the same']"
I Scraped 100 Sports Matches — Here Is What I Found: England 2026 World Cup squad: player-by-player ratings,I Scraped 100 Sports Matches — Here Is What I Found: England 2026 World Cup squad:...,datascience,['I Scraped 100 Sports Matches — Here Is What I Found: England 2026 World Cup']
"A crash-safe job queue for server-side Dart, in two packages","If a worker is killed mid-job, most Dart queue options lose the job. This one does not.  A request...",backend,"['This one', 'Dart queue options', 'the job']"
Building a Multi Page Responsive Metrics Dashboard for E Commerce,Hey dev community! 👋  As a Bachelor computer student I’ve always believed that the best way to learn...,frontend,"['that the best way to learn', 'Hey', 'Bachelor']"
Optimizing Committed-Use Savings Plans for Startups,"Learn how to determine the ideal baseline for committed-use savings plans, maximizing cloud cost efficiency for your startup.",cloud,"['the ideal baseline for committed-use savings plans', 'maximizing cloud', 'efficiency for your startup']"
What is a Transient Prop?,A transient prop is a special prop in styled-components that starts with a dollar sign...,frontend,['special prop in styled-components that starts with']
The Quest for Digital Fiat: Can Cryptocurrencies Truly Fulfill the Promise of Money?,"Why Decentralisation Is a Bug, Not a Feature, When You're Trying to Build Money   There is a...",backend,"['Not a Feature', 'Why Decentralisation Is a Bug', ""When You're Trying""]"
🗑️ Kafka Keeps Data Longer Than retention.ms,"Kafka deletes whole log segments, not individual records, and never the active one. So your data can outlive retention.ms. Here is why, and the config that actually controls it.",backend,"['and never the active one', 'and the config that actually', 'Kafka', 'Here is why', 'So your data can outlive']"
Stop Writing Angular That Only Works Today,Most Angular codebases don't become difficult because Angular is complicated.  They become difficult...,frontend,"['They become', 'Angular', 'Most Angular']"
What do We Need to Learn for Front End Development in 2026?,"We guess after searching through 3-4 articles, you got confused and exhausted and still don’t know...",frontend,"['We guess after searching', 'don’t know']"
Preventing Overselling with Stock Reservation and select_for_update in Django,"Picture two users checking out the same product, with only one unit left in stock, at nearly the same...",backend,"['Picture', 'at nearly the same', 'with only one']"
"AWS Daily Digest — July 08, 2026","☁️ AWS Daily Digest · July 08, 2026 Auto-generated · Groq (Llama 3.3 70B) · Free &amp;...",cloud,"['Auto-generated · Groq', 'Free &amp', 'AWS Daily Digest', 'July', 'Llama 3.3 70B']"
AI Frontend Coders vs. Real Frontend Developers,"Thoughts on how AI coding tools are changing frontend development, freelancing, and developer habits.",frontend,['Thoughts']
MCP for Cloud & DevOps Engineers: What Model Context Protocol Actually Does,"If you work in cloud or DevOps, you've probably seen ""MCP"" show up everywhere this year and quietly...",cloud,"['If you work in cloud or DevOps', 'MCP', 'up']"
Frontend vs Backend Development: Which Path Is Better?,"If you're planning a career in software development, you've probably come across one of the most...",frontend,['one of the most']
LDA vs PCA: the projection that separates your classes is rarely the one with the most variance,"PCA is the reflex when someone says ""reduce the dimensions."" But PCA never looks at your labels, and...",datascience,"['the dimensions', 'But PCA', 'at your labels, and', 'PCA', 'is the reflex when someone says']"
Best Railway Alternatives for Agencies in 2026: Do Not Put Client Production Work on a Prototype Platform,"TL;DR:    Railway is a solid choice for agency demos, pitch builds, and discovery-phase...",cloud,"['TL;DR', 'pitch builds', 'Railway is']"
Migrating a Live Real-Time Communications Platform from AWS to Google Cloud,"11Sight operates a real-time voice and video engagement platform, the communications backbone behind...",cloud,['the communications backbone behind']
Your Pipeline Is 26.6h Behind: Catching Stock Market Sentiment Leads with Pulsebit,Your Pipeline Is 26.6h Behind: Catching Stock Market Sentiment Leads with Pulsebit   We...,datascience,"['Your Pipeline Is 26.6h Behind', 'Catching Stock Market Sentiment Leads with Pulsebit', 'We']"
Top 10 Python Concepts for Freshers.,Top 10 Python Concepts for freshers 👇   1. Variables &amp; Data Types:   Understand...,datascience,"['Python Concepts', 'Data Types:   Understand', 'Variables &amp']"
How I Built a Real-Time Football Stats Tracker: Clark a political football says NBA chief Silver,How I Built a Real-Time Football Stats Tracker: Clark a political football says NBA chief...,datascience,"['How I Built', 'Real-Time Football Stats Tracker:', 'NBA']"
