titulo,texto,categoria,palabras_clave
The Scale Wall: Why AI Gurus Are Building Toys While the World Needs Architects,"The influencer economy sells flashy AI toys while real systems shatter at scale. Notes from six months of auditing broken pipelines, the 10-level hierarchy that separates a demo from an engine, and what real AI engineering actually takes.",datascience,"['Notes from', 'the 10-level hierarchy that separates a demo from an engine', 'and what real AI engineering actually takes', 'AI toys while real']"
Low-Cost EDR for Modern Security Teams,Enterprise-grade endpoint security doesn't have to come with an enterprise price tag. 🔐  Many...,cloud,['Many']
Count usage when a job is accepted—not when the button is clicked,I'm building a browser-based AI photo editor with a no-signup editing flow.  One of the first design...,backend,"['with', ""I'm"", 'browser-based AI', 'One of the first']"
"Building an X / Twitter feed from scratch: the timeline is a sorted array, likes are optimistic, and ""5m ago"" is arithmetic","A social feed looks like a lot of moving parts — timestamps ticking, hearts filling, new posts...",frontend,[]
How Netflix Doesn't Crash During Peak Hours (Cloud Concepts) ! 😱,"Millions of people open Netflix at the same time—during weekends, evenings, or when a new season...",backend,"['Netflix at the same time—during weekends', 'Millions of', 'evenings']"
"Statistics, Parametric and Non-Parametric Tests in Python","Introduction Statistics is one of the fundamental pillars of data science, machine learning,...",datascience,"['machine learning', 'Introduction Statistics is one of the fundamental pillars of data science']"
Next.js 14: Server Components and the Future of React – The Matrix Awakens,"The Quest Begins (The ""Why"")   Honestly, I was stuck in a loop that felt like debugging a...",frontend,"['Honestly', 'The Quest Begins', 'The ""Why']"
Your Pipeline Is 25.2h Behind: Catching Sustainability Sentiment Leads with Pulsebit,"In our recent analysis, we uncovered a notable anomaly: a 24h momentum spike of -0.156 related to...",datascience,['spike']
Drift X : A Porsche 911 Carrera Web Experience,Drift X is a premium web experience concept inspired by the legendary Porsche 911 Carrera. Built with...,frontend,"['Built', 'Drift X', 'Carrera']"
A Small Guide on Building an MVP,Nearly 37% of startups die due to a lack of profitability or capital. The good news is that there is...,cloud,"['Nearly', 'lack of profitability', 'The good news is that there is']"
Cloud Cost Optimization: A Practical Guide for Leaders,"Learn cloud cost optimization strategies for AWS, Azure, and Google Cloud with practical steps for business leaders evaluating IT partners.",cloud,"['AWS', 'steps for business leaders evaluating', 'Google Cloud', 'Learn', 'Azure']"
Saga Pattern Explained: Distributed Transactions in Microservices,Distributed Transactions are one of the hardest problems you can face in any distrubuted systems.  It...,backend,"['Distributed Transactions are one of the hardest problems you can face in any distrubuted systems', 'It...']"
Backend Development Isn't Just CRUD. Abeg Make We Talk True.,"I don lose count of how many times I don see this kind yarns online:   ""Backend development na just...",backend,['Backend development na just']
Salesforce Data Cloud Training | Salesforce Data Cloud Course,🚀 𝗕𝗲𝗰𝗼𝗺𝗲 𝗮 𝗦𝗮𝗹𝗲𝘀𝗳𝗼𝗿𝗰𝗲 𝗗𝗮𝘁𝗮 𝗖𝗹𝗼𝘂𝗱 𝗘𝘅𝗽𝗲𝗿𝘁 𝘄𝗶𝘁𝗵 𝗩𝗶𝘀𝘂𝗮𝗹𝗽𝗮𝘁𝗵! 🎯 Learn how leading organizations unify...,cloud,"['𝗩𝗶𝘀𝘂𝗮𝗹𝗽𝗮𝘁𝗵!', '🚀 𝗕𝗲𝗰𝗼𝗺𝗲 𝗮 𝗦𝗮𝗹𝗲𝘀𝗳𝗼𝗿𝗰𝗲 𝗗𝗮𝘁𝗮 𝗖𝗹𝗼𝘂𝗱 𝗘𝘅𝗽𝗲𝗿𝘁']"
Moving Beyond the MERN Stack: My Roadmap to Modern Backend Engineering,"Like many developers, I started my journey mastering the MERN stack. Building full-stack apps with...",backend,"['Like many developers', 'apps with', 'Building full-stack']"
Rate Limiting Like a Jedi: Building a Real‑Time Notification System at Scale,"The Quest Begins (The ""Why"")   I still remember the night our notification service went from...",backend,"['the night our notification', 'The Quest Begins', 'went from', 'The ""Why']"
How to structure slices with in a Zustand Store,States in a react application plays the role of soul in the application.  A small react application...,frontend,['of soul in the application']
Azure Management Groups 101,"Introduction   As cloud computing advances, effective resource management becomes vital for...",cloud,['Introduction   As cloud']
Cloud AI is not AI — it's a service you rent,"When people talk about AI today, they are not talking about artificial intelligence.  They are...",cloud,"['AI today', 'When', 'They are...']"
MVVM (Model-View-ViewModel) Architecture,🏗️ MVVM (Model-View-ViewModel) Architecture — Explained for Frontend Developers   MVVM is a...,frontend,"['MVVM', 'Explained for Frontend Developers']"
"GPT-Live Needs an Interruption UI, Not Just a Microphone Button","A new generation of real-time voice models makes interruption, cancellation, transcripts, and accessible recovery core interface states.",frontend,"['transcripts', 'cancellation', 'models makes interruption']"
Your NAT gateway is a $30k landmine and nobody warns juniors,"You spend time optimizing a function to be 40 milliseconds faster, but then realize your cloud bill...",cloud,"['but then realize your cloud bill', 'You spend time optimizing a function to be 40 milliseconds faster']"
"AWS Daily Digest — July 15, 2026","☁️ AWS Daily Digest · July 15, 2026 Auto-generated · Groq (Llama 3.3 70B) · Free &amp;...",cloud,"['Auto-generated · Groq', 'AWS Daily Digest ·', 'Llama 3.3 70B', 'Free &amp', 'July 15']"
Inertia matou a API REST do seu projeto Laravel (e talvez tenha feito um favor),"Nem Blade puro, nem SPA de API. O Inertia é o meio-termo que confunde. Você precisava mesmo daquela API separada com Vue consumindo JSON?",frontend,"['Blade puro', 'Vue consumindo JSON', 'O Inertia', 'Você']"
How I Edit Hooks and Add Routes on PocketBase Cloud,Extending with Hooks   PocketBase hooks let you run custom JavaScript on the server — right...,backend,"['Extending with Hooks', 'JavaScript on the server', 'PocketBase', 'let you run custom']"
"""Just Turn It Off in Staging"" — What the Noisy Alert Was Actually Hiding","Every day in staging, the same Google Play 404 alert fired. Killing the source would have made it quiet - but quiet and fixed turned out to be two dif",backend,"['Killing the source', 'out to be two dif', 'Every day in staging', 'the same Google Play 404 alert fired']"
"Why AI Gaming Needs Infrastructure, Not Just Smarter Models",Disclosure: This article was prepared with AI-assisted editing and reviewed by the NewGPI team for...,cloud,"['This article', 'Disclosure']"
Scalable Cross-Browser UI Automation Framework with Cypress and Playwright,"Learn how to design and implement a scalable cross-browser UI automation framework using Cypress and Playwright, with parallelization and maintainable",frontend,"['using Cypress and Playwright', 'UI', 'with parallelization and maintainable']"
The Liquid you lint isn't the Liquid Shopify runs,shopify theme check passed clean. The validator I run before every commit passed too. Then I opened...,frontend,"['Then I', 'The validator I run before every']"
Are cookies bad? Here is what you should know.,"If you've ever visited a website, you've probably seen a popup asking you to ""Accept"" or ""Reject""...",frontend,"['website', 'popup asking you to ""Accept"" or ""Reject']"
"🚀 Performance Is an Architectural Decision, Not a Last-Minute Fix","Every engineering team wants a fast application.  Yet, I've seen the same pattern repeat across...",frontend,"['fast application', 'the same', 'Yet', 'engineering team wants']"
Owning your data again,"Not too long ago, buying something meant owning it perpetually. Your files lived on your machine,...",cloud,"['buying something meant owning', 'Your']"
Inside a Kubernetes Bug Fix: Investigating an Integer Overflow in Dynamic Resource Allocation (DRA),Contributing to a project as large as Kubernetes can feel intimidating at first. Millions of lines of...,cloud,"['Millions of lines of...', 'Contributing to']"
"AWS Daily Digest — July 12, 2026","☁️ AWS Daily Digest · July 12, 2026 Auto-generated · Groq (Llama 3.3 70B) · Free &amp;...",cloud,"['AWS Daily Digest ·', 'Auto-generated · Groq', 'July', 'Llama 3.3 70B', 'Free &amp']"
Part 4: Event handlers are usually the better place for side effect,Part 4 of the Modern React Patterns series  In the previous articles we've been removing useEffects...,frontend,"['Part 4 of the Modern React Patterns', 'useEffects', 'In the previous']"
CSS Triangle Generator — Pure CSS Triangles in 8 Directions,"Overview   CSS Triangle Generator generates pure CSS triangles — no images, no SVG.  🔗...",frontend,"['SVG', 'CSS', 'Overview', 'CSS Triangle Generator']"
auto-animate now speaks marko,"As of @formkit/auto-animate@0.10.0, the library ships an official Marko adapter (PR #239).   If you...",frontend,"['If you', 'As of', 'the library ships an official Marko']"
Stop Breaking Apps: API Versioning in Laravel,"The Mobile Client Lag Trap  When you build SaaS APIs at Smart Tech Devs, you have total control over...",backend,"['The Mobile Client Lag Trap  When', 'APIs at Smart Tech Devs', 'SaaS']"
Keep Keyboard Focus Stable When a Virtualized Grid Recycles Its Rows,"Test a 10,000-row grid where scrolling removes the focused cell from the DOM.",frontend,"['where scrolling', 'the focused cell from the DOM']"
How I Shipped 4 iOS Apps From a Windows PC — Without Ever Touching a Mac,"A year ago, I'd never shipped a mobile app. Today I have four live on the App Store — and I built and...",cloud,"[""I'd"", 'Today I']"
Scaffolding Business Domain Models with Dynamic Schemas,"This article kicks off our new ""Core Platform Capabilities"" series      Operational platforms require...",datascience,"['Core Platform Capabilities', 'Operational platforms require', 'This article kicks off']"
set up your backend with one prompt,"Hi!  I build apps with AI coding agents like Cursor, Claude Code, and Codex, but kept hitting the...",backend,"['Hi!', 'Claude Code', 'apps with', 'Cursor']"
Top Skills You Can Improve Through Machine Learning Competitions,"Machine learning is no longer limited to academic research or large technology companies. Today,...",datascience,"['Machine', 'to academic research or large', 'Today']"
How to Build a Modern React Admin Dashboard from Scratch (Vite + CSS + SVG),"A step-by-step guide to building a stunning, fast, and responsive admin dashboard using React, Vite, and modern CSS techniques.",frontend,"['stunning', 'fast', 'React', 'Vite']"
"Garbage In, Garbage Out: A Beginner’s Guide to Data Cleaning","When you first dive into machine learning, it is easy to get swept up in the excitement of building...",datascience,"['machine learning', 'When you first dive', 'it is easy to get swept up in the excitement of building']"
"Em 2026, alguém ainda usa Blade? Deveria — e tem um motivo escondido","Com tanto framework JS, o Blade virou coisa de boomer? Uma defesa honesta do Blade e uma curiosidade que quase ninguém sabe sobre como ele funciona.",frontend,"['Uma', 'Blade', 'Blade virou coisa de boomer']"
"Modern Frontend Testing Is Mostly About State, Timing, and Geometry","Frontend testing used to sound simple: open a page, find an element, click it, and verify the...",frontend,"['Frontend', 'and verify the...', 'find an element', 'page']"
Your On-Chain AI Agent Is Flying Blind (And You Probably Don't Know It),Your On-Chain AI Agent Is Flying Blind (And You Probably Don't Know It)   Most teams...,backend,"[""And You Probably Don't Know It)   Most teams"", 'Your On-Chain']"
5 Things Every Developer Should Know About the Unmeshed Python SDK,We're excited to announce the launch of the Unmeshed Python SDK -- designed to make it even easier...,backend,"['designed to make it even easier', 'the launch of the Unmeshed Python']"
How I Built a Concurrency-Safe Reservation System,What happens when 100 users try to reserve the same seat at exactly the same time?   Without proper...,backend,"['What happens when 100 users try to reserve the same seat at exactly', 'the same time?', 'Without']"
Agentic AI Is Recreating Problems Distributed Systems Already Solved,Agentic ai distributed systems keep failing in ways that should feel familiar to anyone who spent...,cloud,['keep failing in ways that']
Don't Keep Your Dashboard a Secret ; A Guide to Embedding and Publishing Power BI Reports,Introduction   Think of your Power BI report as a movie. Creating it is just production the...,datascience,"['Think of your Power BI', 'Creating it is just production the...', 'Introduction']"
Banish UI Lag: Custom Hook Interaction Feedback ⚡,Liquid syntax error: Variable '{{% raw %}' was not properly terminated with regexp: /\}\}/,frontend,"['was not properly terminated with', 'Liquid', 'Variable']"
Stop Putting AI Inside Your ERP (Here's a Better Architecture),"If you've worked with enterprise software, you've probably heard this question:   ""Do we need a new...",backend,"['probably heard this', 'Do we need']"
Your Pipeline Is 18.5h Behind: Catching World Sentiment Leads with Pulsebit,Your Pipeline Is 18.5h Behind: Catching World Sentiment Leads with Pulsebit   We recently...,datascience,"['Your Pipeline Is 18.5h Behind', 'Catching World Sentiment Leads with Pulsebit', 'We']"
Design Systems Explained,"Learn what a design system is, why modern engineering teams rely on it, and how to build scalable,...",frontend,"['why modern engineering teams rely on it', 'Learn what', 'system is']"
Power BI DAX Essential Functions — Explained with Examples,"If you’ve ever struggled with CALCULATE() or wondered why SUMX() behaves differently from SUM(), this...",datascience,"['SUM', 'you’ve', 'or wondered why SUMX']"
Your Pipeline Is 23.9h Behind: Catching Healthcare Sentiment Leads with Pulsebit,Your Pipeline Is 23.9h Behind: Catching Healthcare Sentiment Leads with Pulsebit   We...,datascience,"['Your Pipeline Is 23.9h Behind', 'We']"
Your Pipeline Is 10.6h Behind: Catching Healthcare Sentiment Leads with Pulsebit,Your pipeline just missed a major healthcare sentiment shift: a 24-hour momentum spike of +0.293....,datascience,"['major healthcare sentiment shift', 'Your', 'spike of +0.293']"
Where Should You Store Your JWT?,One of the first questions developers face when implementing an authentication flow is:  Where should...,frontend,['One of the first questions developers face when implementing an authentication flow is']
The Offline Awakens: Building PWAs That Feel Like Magic,"The Quest Begins (The ""Why"")   Honestly, I was tired of watching my web apps sputter the...",frontend,"['Honestly', 'The Quest Begins', 'The ""Why', 'apps sputter the']"
Как наладить определение города в локальном Docker и нормально тестировать GeoIP,Как наладить определение города в локальном Docker и нормально тестировать GeoIP   На...,backend,"['Как', 'нормально', 'На...', 'GeoIP', 'Docker']"
Stop Assigning Permissions to Users. Build RBAC the Right Way,Every application starts the same way.  You launch your MVP with just one role:   Admin   A few weeks...,backend,"['Every application starts the same way', 'You launch your MVP with just one', 'Admin   A few weeks']"
Stop Notification Delays: Queue Worker Isolation,The Notification Queue Traffic Jam  When engineering high-volume notification ecosystems at Smart...,backend,['The Notification Queue Traffic Jam  When']
Idempotency keys in Go: the check-then-act race nobody tests for,A request comes in to charge a customer. It times out on the way back. The client retries. Now you've...,backend,"['It times out on the way back', 'Now', 'The client retries']"
Your Pipeline Is 29.1h Behind: Catching Trade Sentiment Leads with Pulsebit,Your Pipeline Is 29.1h Behind: Catching Trade Sentiment Leads with Pulsebit   We recently...,datascience,"['Your Pipeline Is 29.1h Behind', 'Catching Trade Sentiment Leads', 'We']"
.NET for Backend Development,"🚀 Why I Chose .NET for Backend Development   Hello, DEV Community! 👋  This is my first post...",backend,"['DEV Community!', 'Why I Chose .NET', 'This is my first']"
Day 124 of Learning MERN Stack,"Hello Dev Community! 👋  It is officially Day 124 of my software engineering marathon! Today, I...",frontend,"['It is officially Day', 'Hello Dev Community', 'Today']"
AngularJS in 2025: Why It’s Still Relevant (and Risky) for Legacy Systems,Introduction to AngularJS: What It Was and Why It Matters   AngularJS revolutionized web...,frontend,"['AngularJS', 'Introduction to', 'AngularJS: What It Was and Why It Matters']"
The Two-Level Computed Graph: How I Stopped Toggle Events From Re-Running Business Logic,"When you build a mapping interface in Angular Signals, the naive approach puts everything in one...",frontend,"['mapping interface in Angular Signals', 'When', 'the naive approach puts everything in one']"
WebSockets: The Matrix of Real-Time Web Apps,"The Quest Begins (The ""Why"")   Honestly, I still remember the first time I tried to build a...",frontend,"['Honestly', 'The Quest Begins', 'I still remember the first time I', 'The ""Why']"
"The night before launch, every door was wide open",At the end of the last post I mentioned a bill. This post is that bill.  Let me start with three...,backend,"['This post is that bill', 'Let me start with three', 'At the end of the last post I mentioned a bill']"
Why Most Students Learn AI the Wrong Way,"A strange thing is happening in AI education.  Students are completing course after course,...",datascience,"['after course', 'Students are completing']"
IP Geolocation in your app without a local database: free REST API with MaxMind GeoLite2,"Resolve any IPv4 or IPv6 address to country, region, city, timezone, ISP and ASN with one GET â€” no local database, backed by MaxMind GeoLite2 with ip-api.com fallback.",backend,"['city', 'Resolve any IPv4 or IPv6', 'region', 'timezone', 'ISP and ASN with one GET']"
How to Design a Live Scoreboard Without Overloading Your Backend,"A live scoreboard looks simple until traffic arrives.  The product needs to show current match state,...",backend,['The']
The Basic Animation Mechanism in Egui,"As an immediate-mode UI framework, egui handles animations in a fundamentally different way from...",frontend,['egui handles animations in a fundamentally different']
Lease Email Jobs Before Your Worker Sends,"Use PostgreSQL row leases to stop duplicate auth emails when workers retry, crash, or scale out across multiple API nodes.",backend,"['emails when workers retry', 'PostgreSQL']"
🚀 Go Journey – Day 1: Building my first RESTful API with Gin,"Last week, I officially started learning how to build RESTful APIs in Go. To keep things simple, I...",backend,['RESTful APIs in Go']
Design + Product Thinking: NYC’s Path to Reliable AI,"Explores why hiring designers and product managers is essential for delivering usable, trustworthy digital services and AI initiatives in NYC, summarizes the NYC PIT Crew program with a link, and shows how Flamelit applies outcome-focused delivery in the public sector.",datascience,"['link', 'why hiring designers and', 'delivery in the public sector', 'managers is essential for delivering usable', 'summarizes the NYC PIT Crew', 'Flamelit']"
What is Alibaba Cloud? A Complete Beginner's Guide (2026),📌 This article was originally published on Sherdil E-Learning. I'm republishing it here so the...,cloud,"['This article', 'republishing it here so the...', ""I'm"", 'Sherdil E-Learning']"
AI and Data Science course in Hyderabad,AI and Data Science course in Hyderabad: Build a Future-Ready Career with Industry-Focused...,datascience,"['Build a Future-Ready Career with Industry-Focused', 'AI and Data Science course in Hyderabad']"
Rate Limiting Like a Jedi: Keeping Your API Safe from the Dark Side,"The Quest Begins (The ""Why"")   I still remember the first time my side‑project API got...",backend,"['The Quest Begins', 'the first time my side‑project API got', 'The ""Why']"
Amazon Q Review 2026: Is AWS's AI Assistant Worth $19/Month?,Amazon Q isn't trying to be GitHub Copilot. It's AWS's specialist assistant for teams who live inside...,cloud,"[""It's"", 'GitHub Copilot', 'teams who', 'Amazon Q']"
Every HTTP Status Code Tells a Story,"Every time you open a website, sign into an application, or send a request to an API, a server...",backend,"['website', 'or send', 'request to an API', 'Every time you']"
CSS Grid vs Flexbox: The Matrix of Layouts,"The Quest Begins (The ""Why"")   I was building a dashboard the other day—cards that needed to...",frontend,"['The Quest Begins', 'the other day—cards that needed to', 'The ""Why']"
"Legitimate Crypto Recovery Company, Hire Crypto Recovery Services, Zeus Crypto Recovery Services, Bitcoin Recovery Expert",The rapid growth of cryptocurrency has opened the door to incredible opportunities in the digital...,datascience,"['The rapid growth of cryptocurrency', 'opened the door to incredible opportunities in the digital']"
Nashville SC vs Atlanta United FC: Match Prediction & Model Analysis (2026-07-18),Published: 2026-07-16 | footballmoney.top           Nashville SC vs Atlanta United FC — World Cup...,datascience,"['Atlanta United FC — World Cup', 'Published']"
Web Developer Travis McCracken on Building a Developer-Facing API in Go,"Exploring Backend Development with Rust and Go: Insights from Web Developer Travis McCracken  Hello,...",backend,['Exploring Backend Development with Rust and Go: Insights from Web Developer Travis McCracken  Hello']
Why Silent Type Coercion Is the Most Dangerous Bug in a Data Import,A CSV import that crashes is an annoying bug. A CSV import that succeeds and quietly produces the...,datascience,"['A CSV import that succeeds and', 'the...']"
NAT Gateway: The Bill Nobody Reads,Group your AWS bill by service in Cost Explorer and NAT Gateway charges don't get their own row....,cloud,"['Cost Explorer and NAT Gateway', 'AWS', 'own row']"
"Building a Tree View from scratch: recursion, a roving tabindex, and the ARIA tree contract",The file tree in your editor's sidebar looks like a solved problem you would never build yourself....,frontend,['file tree in your']
Best Cursed Font Tool,"As technology continues to evolve, the most successful online platforms are often the ones that...",frontend,['the most successful online']
Why Is API Orchestration Still So Painful?,Client’s Dilemma   Commodity Trading firms frequently orchestrate multiple backend services...,backend,"['Dilemma', 'Commodity Trading']"
The Database Quest: Dodging N+1 Queries Like in The Matrix,"The Quest Begins (The ""Why"")   Honestly, I still remember the first time I watched our app’s...",frontend,"['Honestly', 'The Quest Begins', 'I still remember the first time I', 'The ""Why']"
Introduction to Machine Learning,"Introduction   In the course of the last month, I got introduced to Machine Learning. I...",datascience,"['I got introduced to Machine Learning', 'In the course of the last month', 'Introduction']"
Terraform Cloud: alertas de failover comprobables,"Guía práctica para validar alertas de failover en Terraform Cloud con correos verificables, menos ruido y runbooks más confiables.",cloud,"['Guía', 'Terraform Cloud']"
The Share Button Is the Product: Engineering a Viral Loop in Vanilla JS,Most of us treat the share button as the last checkbox before shipping: drop in a navigator.share...,frontend,['Most of us treat the share button as the last checkbox before shipping']
"""EXCEL IN THE REAL-WORLD DATA ANALYSIS""","What Is Excel  Basically, Microsoft Excel or Excel is a spreadsheet software developed by Microsoft...",datascience,"['What Is Excel', 'Microsoft', 'Microsoft Excel or Excel is']"
"OrderHub Day 26: my first Kafka consumer, where inventory reserves stock all by itself",Day 25 of building OrderHub — my from-scratch Spring Boot order system — gave order-service a Kafka...,backend,"['Spring Boot', 'Day 25 of building', 'Kafka']"
Your Webhook Returned 200 OK. Did the Event Actually Get Processed?,A webhook provider sends an event. Your endpoint returns 200 OK. The provider stops...,backend,"['webhook provider', 'Your', 'The provider stops', 'OK']"
The Invisible Frontend: Small Decisions That Quietly Save a Product,The best frontend work never shows up in a demo. Here's why founders should care anyway.  The...,frontend,"['The...', 'The best frontend work', 'anyway', ""Here's why founders should"", 'up in a demo']"
Why Your FastAPI App Works Locally But Fails in Production,"FastAPI works locally but fails in production? The five usual causes: Uvicorn workers, QueuePool limits, event loop blocking, and Docker CPU limits.",backend,"['Docker CPU limits', 'The five', 'QueuePool', 'Uvicorn', 'FastAPI', 'but fails in production?']"
How to Merge DOCX Files Using Node.js REST API,Merging multiple WORD documents into a single file can be surprisingly tedious if you’re not using...,cloud,"['single file can be surprisingly tedious if', 'Merging multiple WORD']"
Idempotency Keys: Designing APIs for Robust Retry Logic,Learn how idempotency keys can enhance API reliability during retries at scale.,backend,['at scale']
