titulo,texto,categoria,palabras_clave
Save $$$ for your family/friends/religious group/co-workers,Hello-  If you are an IT professional/amateur practitioner in Canada (where this tip is coming from)...,cloud,"['If you are an IT', 'Hello-', 'where this tip is coming from']"
Enterprise Backup Architecture Considerations 2026,Enterprise Backup Architecture Considerations 2026            Planning Your Backup...,cloud,['Enterprise Backup Architecture Considerations 2026            Planning Your Backup']
Can a Free Cloud Agent Repair a Modal Without Breaking Keyboard Focus?,Use an executable keyboard regression to evaluate an AI-generated accessibility fix.,frontend,[]
Survivorship Bias vs Lookahead Bias: The Two Silent Backtest Killers,Most blown-up backtests aren't wrecked by a bad strategy idea. They're wrecked by two data problems...,datascience,"[""They're wrecked"", 'Most blown-up backtests']"
How Many Uvicorn Workers Do You Actually Need? (FastAPI Performance Guide),"Stop guessing your worker count. Learn the (2 x CPU) + 1 formula, avoid the Docker CPU trap, and optimize FastAPI concurrency for production.",backend,"['the Docker CPU trap', 'Stop guessing your worker count', 'Learn the', 'FastAPI']"
Stop API Spam: Debouncing React Inputs ⚡,The Live Search DDoS  Live search inputs are a staple of modern B2B dashboards at Smart Tech Devs. As...,frontend,"['The Live Search DDoS  Live', 'As', 'Tech Devs']"
Run an Exit Drill Before Free Cloud Coding Becomes a Switching Cost,Measure whether accepted work can leave an AI coding SaaS before investing team time.,cloud,"['SaaS before investing team time', 'Measure whether accepted work can leave an AI']"
"We published the article most ""AI made our code better"" posts skip — the honest","We published the article most ""AI made our code better"" posts skip — the honest comparison. Results:...",frontend,"['Results', 'the honest comparison', 'posts skip', 'We']"
Your Pipeline Is 9.9h Behind: Catching Blockchain Sentiment Leads with Pulsebit,Your Pipeline Is 9.9h Behind: Catching Blockchain Sentiment Leads with Pulsebit   We just...,datascience,"['Your Pipeline Is 9.9h Behind', 'We just', 'Blockchain Sentiment Leads with Pulsebit']"
"Yes, another tree classifier. Here's what building one from scratch taught me.",I spent way too long building a tabular classifier from scratch. It doesn't beat XGBoost. I'm...,datascience,"[""I'm"", 'too long', ""It doesn't beat XGBoost""]"
Next.js 14: Server Components — The Empire Strikes Back on React,"The Quest Begins (The ""Why"")   Honestly, I was tired of watching my React apps choke on...",frontend,"['Honestly', 'The Quest Begins', 'The ""Why']"
"Why Your Translation Pipeline Melts at 10x Traffic (And How to Fix the Architecture, Not the Code)","Why Your Translation Pipeline Melts at 10x Traffic (And How to Fix the Architecture, Not the...",backend,"['Not the...', 'And How to Fix the Architecture', 'Why Your Translation Pipeline Melts at 10x Traffic']"
"AWS Daily Digest — July 14, 2026","☁️ AWS Daily Digest · July 14, 2026 Auto-generated · Groq (Llama 3.3 70B) · Free &amp;...",cloud,"['Auto-generated · Groq', 'AWS Daily Digest', 'July 14', 'Llama 3.3 70B', 'Free &amp']"
Looking for the best Go (Golang) course on YouTube,Hi everyone!  I'm looking for a high-quality Go (Golang) course on YouTube and would love to hear...,backend,"['high-quality Go', ""I'm"", 'Golang']"
I built a free Azure naming tool that knows every resource type's rules,"Every Azure team needs a naming convention, and Microsoft's Cloud Adoption Framework defines a good...",cloud,"['naming convention', 'Every Azure', ""Microsoft's Cloud Adoption Framework""]"
React.js Development Cost in 2026: A Complete Guide for Businesses,"If you're planning to build a React application in 2026, one of the first questions you'll ask...",frontend,"['React application in 2026', 'one of the first']"
JPG to HTML Conversion Using Java REST API,Did you know that converting JPG files to HTML can often lead to unexpected rendering issues? Many...,cloud,"['JPG', 'Did you know that', 'Many', 'HTML']"
"Data Science Training in Hyderabad | Python, AI & Machine Learning Course | Quality Thought","In today's technology-driven world, Data Science has become one of the fastest-growing and...",datascience,"[""In today's technology-driven world"", 'Data Science']"
Day 140 of Learning MERN Stack,"Hello Dev Community! 👋  It is officially Day 140 of my software engineering marathon! Today, I...",frontend,"['It is officially Day 140 of my software engineering marathon! Today', 'Hello Dev Community']"
Restoring Structural Neutrality: Neutralizing Cross-Site Fingerprinting via Static Navigation,The Exploitation of Device Metadata in Public Web Indexes The open web has largely discarded the...,cloud,['The Exploitation of Device Metadata in Public Web Indexes The']
8 Smart View Transitions API Patterns Every Frontend Dev Should Use,"View Transitions API patterns are finally usable across browsers in 2026 with broad Chromium and Safari support, and they fundamentally change what is possible ",frontend,"['browsers in 2026 with broad Chromium and Safari', 'what is possible', 'View Transitions']"
Comparing PDF Documents with Node.js REST API for Efficient Analysis,"When comparing PDF documents, many developers overlook the complexities of ensuring accurate results....",cloud,"['many developers overlook the complexities of ensuring accurate', 'PDF', 'When']"
Exploratory Data Analysis (EDA) with Pandas: How I Turn Raw Data into Meaningful Insight,"The first time I opened a dataset, I made a rookie mistake. I was eager to build charts, train...",datascience,"['The first time I', 'rookie mistake']"
"AWS Daily Digest — July 05, 2026","☁️ AWS Daily Digest · July 05, 2026 Auto-generated · Groq (Llama 3.3 70B) · Free &amp;...",cloud,"['AWS Daily Digest ·', 'Auto-generated · Groq', 'July 05', 'Llama 3.3 70B', 'Free &amp']"
"Your ""Simple"" CRUD App Is Secretly a Distributed Systems Problem","Your ""Simple"" CRUD App Is Secretly a Distributed Systems Problem   Every developer has a...",backend,"['Your ""Simple""', 'CRUD App Is Secretly', 'Distributed Systems Problem   Every']"
Not Every Payment Failure Is Your Customer's Fault,A customer adds products to their cart.  They enter their card details.  The bank has sufficient...,backend,"['The bank', 'They enter their']"
5-Page FastAPI Backend CRUD Cheat Sheet / Starter Guide for beginners! 🚀,"FastAPI CRUD Explained for Beginners  When I started learning FastAPI, CRUD looked confusing.  Then I...",backend,"['CRUD', 'FastAPI CRUD Explained for Beginners', 'Then I', 'FastAPI', 'When I']"
AWS Textract vs Google Vision (and When to Skip Both),"The first time I had to choose an OCR service for a document pipeline, I spent a week benchmarking...",cloud,"['The first time I', 'OCR', 'week benchmarking']"
Your Pipeline Is 22.5h Behind: Catching Travel Sentiment Leads with Pulsebit,Your Pipeline Is 22.5h Behind: Catching Travel Sentiment Leads with Pulsebit   We just...,datascience,"['Travel Sentiment Leads with Pulsebit', 'Your Pipeline Is 22.5h Behind', 'We just']"
Your Pipeline Is 18.5h Behind: Catching World Sentiment Leads with Pulsebit,Your Pipeline Is 18.5h Behind: Catching World Sentiment Leads with Pulsebit   We recently...,datascience,"['Your Pipeline Is 18.5h Behind', 'Catching World Sentiment Leads with Pulsebit', 'We']"
OpenAI GPT-5.6 & ChatGPT Work; Meta Muse Spark 1.1 API; Google AlloyDB AI Local Inference,OpenAI GPT-5.6 &amp; ChatGPT Work; Meta Muse Spark 1.1 API; Google AlloyDB AI Local...,cloud,"['ChatGPT Work', 'AI Local', 'OpenAI', 'Meta Muse Spark', 'Google']"
Your Pipeline Is 27.6h Behind: Catching Innovation Sentiment Leads with Pulsebit,Your Pipeline Is 27.6h Behind: Catching Innovation Sentiment Leads with Pulsebit   We...,datascience,"['Catching Innovation Sentiment Leads with Pulsebit', 'Your Pipeline Is 27.6h Behind', 'We']"
"# AVIF vs WebP vs JPEG: Real Compression Benchmarks (Browser-Side, 2026)",I compressed 500 images through 4 formats. Here are the numbers.      TL;DR: AVIF produces files 50%...,frontend,"['Here are the numbers', 'TL;DR']"
The Millisecond Miracle: Why Databases Are the Unsung Heroes of Tech,"We talk a lot about stunning UIs, smooth animations, and the latest frontend frameworks. But what...",backend,"['and the latest frontend frameworks', 'But what', 'UIs']"
How a Football Match Helped Me Understand Kubernetes: Desired State vs Actual State,Have you ever wondered what Desired State and Actual State mean in Kubernetes?  I used to hear those...,cloud,['Have you ever wondered what Desired State and Actual State mean in Kubernetes?']
"AWS S3 Deep Dive — Objects, Encryption, Bucket Policies & Everything In Between",Part of my AWS learning journey — transitioning from Systems Engineer to Cloud/DevOps. This session...,cloud,"['Engineer to Cloud', 'This session', 'Part of my AWS', 'DevOps']"
Provide Storage for the IT Department Testing and Training,What is Azure Storage? Azure Storage is Microsoft’s cloud-based storage solution that provides...,cloud,"['What is Azure Storage?', 'Azure Storage is Microsoft’s']"
Stop API Floods: Redis Sliding Window Rate Limits ⚡,"The Fixed Window Vulnerability  When protecting your SaaS API at Smart Tech Devs, rate limiting is...",backend,"['The Fixed Window Vulnerability  When protecting', 'SaaS', 'Tech Devs']"
How Spotify Delivers Music to Millions: The Cloud Optimization Behind Every Play,"Have you ever wondered how Spotify starts playing your favorite song almost instantly, even when...",cloud,"['Spotify starts playing your favorite song', 'Have you ever wondered']"
Meta-Analysis: Meta-Regression,"Adapted from an appendix of my MS thesis.            Meta-Regression   Usually, regression models...",datascience,"['Adapted from an appendix of my MS', 'Usually']"
8 Azure Interview Questions That Reveal Who's Actually Run a Subscription,"I once sat across from a candidate who'd listed ""Azure"" four separate times on his resume — AZ-104,...",cloud,"['four separate times on his', 'Azure']"
The Cheapest Dedicated Servers in 2026: A Price-Checked Shortlist,"If you have ever tried to price a bare-metal server, you know the game: a big ""from $X/mo"" on the...",cloud,"['big', 'you know the game']"
I kept re-explaining my stack to Claude on every new project — so I built it one,"fe-rail solved the workflow problem. Spec, build, review, PR. The agent stopped skipping steps,...",frontend,"['the workflow problem', 'fe-rail solved', 'PR', 'The agent', 'Spec']"
Your Pipeline Is 26.1h Behind: Catching Artificial Intelligence Sentiment Leads with Pulsebit,Your Pipeline Is 26.1h Behind: Catching Artificial Intelligence Sentiment Leads with...,datascience,"['Catching Artificial Intelligence Sentiment Leads with', 'Your Pipeline Is 26.1h Behind']"
How Alibaba Cloud CDN Accelerates Your Global Applications,"How Alibaba Cloud CDN Accelerates Your Global Applications   If your users are in Asia,...",cloud,['How Alibaba Cloud CDN Accelerates Your Global Applications   If your users are in Asia']
Maintaining P99 Latency with Autoscaling Cold Starts,Explore how to manage autoscaling cold starts while keeping p99 latency flat without incurring idle costs.,cloud,"['Explore', 'latency flat without incurring idle costs', 'starts while keeping p99']"
"Real-Time vs Batch Indexing: Stop Choosing, Start Combining",Your Indexing Pipeline Is Not Broken — It's Just Incomplete   There's a recurring pattern in...,backend,"[""It's Just Incomplete   There's"", 'Your Indexing Pipeline Is Not Broken —']"
Building a Video Thumbnail Generator Service in Go With FFmpeg and Sprite Sheets,"How I built an async video thumbnail service in Go: fast FFmpeg frame extraction with input seeking,",backend,"['How I', 'seeking', 'video thumbnail service in Go: fast FFmpeg frame extraction with']"
Route-Level Performance Budgets for Modern Web Apps,"Modern applications rarely have one performance profile. A landing page, search result, dashboard,...",frontend,"['search result', 'Modern applications rarely have one performance profile']"
The Outbox Pattern Explained (Complete Guide),"Your service writes an order to the database, then publishes an event to Kafka. Two lines. Nobody...",backend,"['Nobody', 'Kafka', 'then', 'Two lines', 'Your']"
We graded 13 famous trading strategies on 6 years of data. All 13 failed.,"Every trading book, YouTube channel, and Discord server teaches the same classics:...",datascience,"['YouTube', 'Discord server', 'the same classics']"
Want to quit Excel and level up? PowerBI is the answer.,"What is Power BI?   Power BI is a free tool from Microsoft that lets you connect to data,...",datascience,"['What is Power BI?', 'free tool from Microsoft that lets you connect to data', 'Power BI']"
Replay Windows for Email Change Tokens,"Changing an account email looks simple in product mocks, but the backend path is easy to get wrong....",backend,"['Changing an', 'but the backend path is easy to get wrong']"
Load Balancing: The Neo Way to Dodge Traffic,The Quest Begins (The “Why”)   I still remember the night our API started to sputter under a...,backend,"['The Quest Begins', 'the night', 'The “Why']"
Your Pipeline Is 23.7h Behind: Catching Trade Sentiment Leads with Pulsebit,Your pipeline is 23.7 hours behind: catching trade sentiment leads with Pulsebit   We...,datascience,"['Your', 'catching trade sentiment leads with', 'hours behind', 'We']"
Designing a Cost-Effective Serverless Certificate Generation System on AWS,How I used AWS Lambda and Amazon S3 to build a scalable certificate platform that minimizes storage...,cloud,"['platform that minimizes storage', 'AWS Lambda and Amazon S3', 'How I']"
Google Cloud Data Agent Kit: Build Pipelines from Your IDE Without the Boilerplate,"Google Cloud Data Agent Kit adds BigQuery, GCS, and Spark to your IDE. Build data pipelines in VS Code or Claude Code without writing boilerplate SQL.",cloud,"['Code or Claude Code without writing boilerplate SQL', 'Build', 'Spark to your IDE', 'GCS', 'Google Cloud Data Agent Kit adds BigQuery']"
LINTelligent — AI-Integrated service for code linting and reviewing with MCP server,"Introduction   This is a post I need to share with you my thought process, decisions that I...",backend,"['with you my thought process', 'Introduction', 'decisions that I']"
Taming Codebases: Feature-Sliced Design (FSD) in React 🏗️,"The ""Folder Soup"" Problem  When starting a React or Next.js project, teams usually group files by...",frontend,"['Problem  When', 'teams usually group', 'The ""Folder Soup', 'React or Next.js project']"
CSS Formatter: Why Every Frontend Developer Should Use One,Have you ever opened a CSS file and found thousands of lines of compressed or poorly formatted...,frontend,"['Have you', 'CSS file and found thousands of lines of compressed or poorly formatted']"
# PNG vs WebP vs AVIF: The Ultimate Image Format Guide for 2026,"Stop guessing which format to use. Here's the data, the tradeoffs, and exactly when to pick each...",frontend,"['the tradeoffs', ""Here's the data"", 'which format to use', 'Stop', 'and exactly when to pick each']"
Resume for Data Entry to Analyst Pivot as International Student on CPT,"Learn how to write a resume for a data entry to analyst pivot as an international student on CPT. Includes before/after rewrites, CPT-friendly formatting, and ATS tips.",datascience,"['Includes', 'before/after rewrites', 'ATS']"
Your Pipeline Is 27.2h Behind: Catching Sports Sentiment Leads with Pulsebit,Your Pipeline Is 27.2h Behind: Catching Sports Sentiment Leads with Pulsebit   We recently...,datascience,"['Your Pipeline Is 27.2h Behind', 'Catching Sports Sentiment Leads with Pulsebit', 'We']"
Batasan Bandwidth MEGA Dijelaskan: Dampaknya pada Alur Kerja Anda,Are you looking into batasan bandwidth mega dijelaskan? Here's a quick overview of what you need to...,cloud,"['Are you', 'quick overview of what you need to', 'batasan bandwidth', ""Here's"", 'dijelaskan']"
"Point-in-Time Fundamentals Data: What It Is, Why It Matters, and How to Choose","If you backtest strategies on company fundamentals — earnings, revenue, book value, cash flow — the...",datascience,[]
What do We Need to Learn for Front End Development in 2026?,"We guess after searching through 3-4 articles, you got confused and exhausted and still don’t know...",frontend,"['We guess after searching', 'don’t know']"
Mastering React.js Fundamentals,ReactJS is a component-based JavaScript library used for building dynamic and interactive user...,frontend,"['ReactJS', 'JavaScript']"
How We Fixed the Silent Payment Bug That Cost Us Real Money,How We Fixed the Silent Payment Bug That Cost Us Real Money   This morning I was reviewing...,backend,['How We Fixed the Silent Payment Bug That Cost Us Real Money   This morning I']
Day 120 of Leaning MERN Stack,"Hello Dev Community! 👋  It is officially Day 120 of my software engineering marathon! Today, I...",frontend,"['It is officially Day 120 of my software engineering marathon! Today', 'Hello Dev Community']"
Caching Like a Jedi: Strategies Every Backend Developer Must Understand,"The Quest Begins (The ""Why"")   I still remember the night our API started buckling under a...",backend,"['The Quest Begins', 'the night', 'The ""Why']"
Why Data Science Is the Smartest Career Choice in Kerala for the Next Decade,"Data has become one of the most valuable assets in the modern world. Every online purchase, mobile...",datascience,"['Every', 'assets in the modern world']"
Protocol Buffers,"Protocol Buffers are language-neutral, platform-neutral extensible mechanisms for serializing...",backend,['Protocol Buffers']
The Silent Rot in Your Data Pipeline,The Silent Rot in Your Data Pipeline   There's a category of bug that doesn't crash your...,backend,"[""The Silent Rot in Your Data Pipeline   There's""]"
Transforming a Restaurant Website into an Operational Ecosystem,There was a time when it was enough for a restaurant to have a simple website with a menu and a...,frontend,"['There', 'menu and', 'time when it was']"
Building GateKeeper: Designing a Role-Based Access Control Library in Pure Go,"As developers, we use authorization libraries almost every day. Whether it's a web application, an...",backend,"['we use authorization libraries almost', ""Whether it's""]"
"API Design: REST vs GraphQL vs gRPC, Versioning, Idempotency, and Errors","API design as a long-lived contract: REST vs GraphQL vs gRPC, resource modeling, versioning, pagination, idempotency keys, RFC 9457 errors, auth, and rate limiting.",backend,"['gRPC', 'auth', 'API', 'GraphQL']"
8 Powerful SvelteKit Features That Make React Look Verbose,SvelteKit features are why a growing share of senior frontend engineers have quietly migrated their personal projects (and sometimes company projects) to Svelte,frontend,"['growing share of', 'Svelte', 'SvelteKit']"
Upgrading to Next.js 16: Field Notes from Two Production Apps,Headline: I upgraded two real apps — this portfolio and an internal operations dashboard — from...,frontend,['Headline']
We graded 13 famous trading strategies on 6 years of data. All 13 failed.,"(https://tessen.ai/strategies)  Every trading book, YouTube channel, and Discord server teaches the...",datascience,"['YouTube', 'Discord server', 'Every trading book']"
Small Models That Think Harder Beat Big Models That Sound Confident,People keep saying reasoning needs scale. That you can't get reliable chain-of-thought out of...,datascience,"[""That you can't get reliable chain-of-thought out of"", 'People']"
"Who Is Mohammad Shafaque Arif? A Software Developer Passionate About DevOps, Cloud Computing, and Modern Infrastructure","Who Is Mohammad Shafaque Arif? My Journey into Full Stack Development, DevOps, and Cloud...",cloud,"['Full Stack Development', 'DevOps', 'Cloud', 'Who Is Mohammad Shafaque Arif?']"
Your Pipeline Is 28.7h Behind: Catching Economy Sentiment Leads with Pulsebit,Your Pipeline Is 28.7h Behind: Catching Economy Sentiment Leads with Pulsebit   We recently...,datascience,"['Your Pipeline Is 28.7h Behind', 'Economy Sentiment Leads', 'We']"
Day 116 of Learning MERN Stack,"Hello Dev Community! 👋  It is officially Day 116 of my software engineering marathon! Today, I...",frontend,"['It is officially Day 116 of my software engineering marathon! Today', 'Hello Dev Community']"
Beyond prediction: causal inference and experiments in credit,"Originally published at han-co.com · Part of the ""Basics"" strand of my Credit &amp; Finance Data...",datascience,"['Part of the ""Basics"" strand of my Credit &amp', 'Originally', 'Finance Data']"
Cookie attributes,🍪           A Deeper Look at Cookie Attributes   📦 Set-Cookie Header  When a server wants to create...,backend,"['A Deeper Look at Cookie Attributes', 'Set-Cookie Header  When']"
Your Pipeline Is 13.8h Behind: Catching Environment Sentiment Leads with Pulsebit,Your pipeline just hit a notable snag: we’ve detected a sentiment spike of +0.425 with a momentum of...,datascience,"['sentiment spike of +0.425 with', 'Your', 'we’ve detected', 'momentum of']"
You Cannot Compose Safety From Individual Findings: The Formal Result the Cloud Security Industry Ignores,Why scanning individual resources can never prove a system is secure. The 50-year-old formal result that explains the structural limitation of every cloud security scanner on the market.,cloud,"['Why', 'The 50-year-old formal result that explains the structural limitation of every cloud security scanner on the market', 'system is secure']"
Predicting Bottlenecks Before They Happen: AI in Hospital Patient Flow,If you've ever sat in an emergency waiting room for five hours while staff scrambled and hallways...,datascience,"['and hallways', 'sat in an emergency waiting room for five', 'hours while staff']"
HTTP/3: Why the Web Finally Moved Beyond TCP,"In the previous article, we explored how HTTP/2 transformed web communication.  Instead of opening...",backend,"['Instead of opening', 'In the previous article']"
Build a Merchant Crypto Launch Kit for Agencies,Most developers think about crypto payments as an integration problem.  A merchant needs to accept...,backend,['payments as an integration problem']
Database Marketing,"We are providing database marketing services which is fully authenticated, qualified, sorted and well...",backend,"['which is fully authenticated', 'We are providing']"
Your Clinical Database Is Lying to You (And You Already Know It),There is a specific moment most clinical data engineers recognize immediately.  You are three weeks...,datascience,"['There', 'You are three weeks']"
How to Become a Front End Web Developer in 2026?,[ ](unifiedmentor.com)  Start your journey today by becoming a Front End Web Developer. They build...,frontend,"['They', 'journey today by', 'Start your', 'Front End Web Developer']"
Your Pipeline Is 21.7h Behind: Catching Mobile Sentiment Leads with Pulsebit,Your Pipeline Is 21.7h Behind: Catching Mobile Sentiment Leads with Pulsebit   We recently...,datascience,"['Your Pipeline Is 21.7h Behind', 'Catching Mobile Sentiment Leads with Pulsebit', 'We']"
FLEXBOX IN CSS,WHAT IS FLEXBOX IN CSS ?  CSS Flexbox (Flexible Box Layout) is a CSS layout system designed to make...,frontend,"['CSS Flexbox', 'CSS', 'Flexible Box Layout']"
RAID Doesn't Protect You From the Corruption That Actually Gets You,The problem   A client's RAID 6 array did exactly what it was designed to do for eighteen...,backend,['what it was']
Deploying Redpanda Kafka-Compatible Streaming Platform on Ubuntu 24.04,Why Your Kafka Setup Is Doing More Work Than Your Actual Data Pipeline   There's a specific...,backend,"[""Why Your Kafka Setup Is Doing More Work Than Your Actual Data Pipeline   There's""]"
Killing the two year feature freeze: modernizing banking tech in isolation 🛠️,"Forcing your engineering team into a two year feature freeze for a ""Big Bang"" cloud migration is a...",cloud,"['Forcing your engineering team', 'Big Bang']"
Step-by-Step Guide to Configuring Monitoring for Azure Compute Services Using Azure Monitor.,"Introduction   Effective monitoring is a critical component of maintaining secure, reliable,...",cloud,"['Introduction   Effective', 'of maintaining secure']"
Power BI Is Not Built for Small Teams. Here's the Honest Alternative,Power BI's $10/user/month price makes it look affordable compared to Tableau. But for small teams...,datascience,"['But for small teams', 'Power', 'it look affordable compared to Tableau']"
How to Build Medical Device Connectivity for Healthcare Interoperability,Healthcare software is no longer limited to standalone applications. Modern hospitals operate an...,frontend,['Modern hospitals operate an']
WebAssembly Sparks Frontend Revolution with 20x Speed Gains,"WebAssembly boosts frontend frameworks' speed by up to 20x, transforming web apps with near-native performance and seamless integration.",frontend,"['WebAssembly', 'apps with', 'performance and seamless integration', 'speed by up to 20x']"
Cómo probar correos de handoff en guardias SRE,"Guía práctica para validar correos de handoff en guardias SRE con Kubernetes, trazabilidad limpia y menos ruido en bandejas reales.",cloud,"['SRE', 'Guía', 'Kubernetes']"
Elastic Net: why blending L1 and L2 beats lasso on correlated features,"Regularization is usually taught as a two-horse race: ridge or lasso, L2 or L1. But there is a case...",datascience,"['L2 or L1', 'Regularization is usually taught']"
I gave an AI agent the same deployment on four clouds.,"Full disclosure up front: I run one of the four platforms in this test (redu.cloud), so take my...",cloud,['up front']
