titulo,texto,categoria,palabras_clave
PostgreSQL Query Optimization: Reducing API Response Time from 2.8 Seconds to 74 Milliseconds,"Introduction  Performance issues rarely announce themselves with obvious errors. More often, they...",backend,"['More', 'Introduction  Performance']"
Kafka Migration: 200 Percent Data Freshness Improvement,The Problem With Cloud AI   Every token costs money. Every API call adds up. And your data...,backend,"['Every API call adds up', 'And your', 'The Problem With Cloud AI']"
"Deployed Safi Budget v2.0: Why I Chose ""Mindful Friction"" Over Automation","Today is a big milestone for me. I finally took my personal budgeting project, Safi Budget Engine...",frontend,"['big milestone for me.', 'Safi Budget Engine', 'budgeting project', 'Today is']"
"2-3 products is the Gumroad sweet spot (+40% per product). At 8+, you earn less than a solo seller.","📊 Originally published on InsightRaider — a data platform tracking 152,362 active Gumroad...",datascience,"['Gumroad', 'platform tracking', 'Originally published on InsightRaider']"
Securing a FastAPI Backend with Bandit: A Real SAST Analysis,"1. Introduction   In modern software development, shipping features fast often comes at the...",backend,"['shipping features fast', 'In modern software development', 'Introduction', 'comes at the...']"
Refresh Tokens on the Frontend: Architecture & Implementation,"Introduction   Modern SPAs (React, Vue, Next.js, etc.) often rely on JWT-based...",frontend,"['Vue', 'Introduction   Modern SPAs', 'React']"
Fifth challenge on DevOpsLedger,Commit terraform.tfstate to the Repo So Everyone Shares It?  A teammate wants to commit...,cloud,"['Commit', 'It?  A teammate wants to commit']"
Your Pipeline Is 16.5h Behind: Catching World Sentiment Leads with Pulsebit,Your Pipeline Is 16.5h Behind: Catching World Sentiment Leads with Pulsebit   We recently...,datascience,"['Your Pipeline Is 16.5h Behind', 'Catching World Sentiment Leads with Pulsebit', 'We']"
Serverless Computing: The Feynman Explanation,Serverless is one of those buzzwords that gets thrown around constantly in modern software...,cloud,"['Serverless is one of those buzzwords that gets', 'around constantly in modern software']"
The payout math of running a trading community (a 3-variable model),"Most people who run a trading group, a signals channel, or a bot community have never modeled what...",datascience,"['Most people who', 'community', 'signals channel']"
Copado Training | Salesforce DevOps with Copado Training,What Is Salesforce DevOps with Copado and How Does It Work? Introduction Salesforce applications...,cloud,"['Introduction Salesforce', 'Copado and How Does It Work', 'What Is Salesforce DevOps']"
Your Pipeline Is 10.5h Behind: Catching Climate Sentiment Leads with Pulsebit,Your Pipeline Is 10.5h Behind: Catching Climate Sentiment Leads with Pulsebit  We just noticed a...,datascience,"['Catching Climate Sentiment Leads with Pulsebit', 'We', 'Your Pipeline Is 10.5h Behind']"
8 Critical Core Web Vitals Tactics for Faster Sites in 2026,Core Web Vitals tactics are not optional anymore — Google’s INP metric replaced FID in 2024 and the bar for “good” performance is higher across the board. The t,frontend,"['Core Web Vitals', 'FID in 2024 and the bar for “', 'The t', 'performance is higher across', 'INP metric', 'the board']"
S3 Static Hosting with HTTP-Errors Redirects — Solved,"If you have ever deployed a Single Page Application (SPA) or a static site using Amazon S3, you might...",frontend,"['Amazon S3', 'SPA', 'Single Page Application']"
Your Pipeline Is 20.3h Behind: Catching Governance Sentiment Leads with Pulsebit,Your Pipeline Is 20.3h Behind: Catching Governance Sentiment Leads with Pulsebit   We just...,datascience,"['We just', 'Catching Governance Sentiment Leads with Pulsebit', 'Your Pipeline Is 20.3h Behind']"
7 Lessons I Learned While Building a Modern Website From Scratch,"When I started building a modern website, I believed the hardest part would be writing code, choosing...",frontend,"['When I', 'I believed the hardest part would be writing code']"
Basic Cloud Concepts,Before you deploy a single resource you need to understand the basics and foundation of the cloud. In...,cloud,"['you need to understand the basics and foundation of the cloud', 'Before you', 'In...']"
Mail Tracker,MailTracker will hook into all outgoing emails from Laravel and inject a tracking code into it. It...,backend,"['It...', 'tracking', 'all outgoing emails from Laravel and inject', 'MailTracker will hook']"
Your Pipeline Is 25.2h Behind: Catching Economy Sentiment Leads with Pulsebit,Your Pipeline Is 25.2h Behind: Catching Economy Sentiment Leads with Pulsebit  We recently discovered...,datascience,"['Your Pipeline Is 25.2h Behind', 'Economy Sentiment Leads', 'We']"
"OrderHub Day 29: the orchestration saga — one coordinator owns the whole order flow with commands, replies, and compensation",On Day 28 of building OrderHub I wired four microservices into a distributed transaction using...,backend,"['On Day 28 of building', 'OrderHub I', 'wired four']"
Make a Real-Time Transit Map Useful Without the Map,An accessible interaction model for animated train maps inspired by today's voxel Tokyo project.,frontend,"['An', 'train maps inspired', 'Tokyo']"
Handling Burst Traffic: Backpressure and Rate Limiting for AI APIs,Explore effective backpressure and rate limiting strategies for AI endpoints under burst traffic to maintain performance and cost efficiency.,backend,['Explore']
Some Bugs Aren't in Your Code. They're Hidden in Your Dependencies.,This is my second submission for DEV's Summer Bug Smash: Smash Stories powered by Sentry.  As...,backend,"['As', 'by Sentry', ""This is my second submission for DEV's Summer Bug Smash: Smash Stories""]"
Starting My Frontend Development Journey: Day 2 of #100DaysOfCode 💻🚀,Building a strong foundation in JavaScript isn't just about writing syntax.it's about understanding...,frontend,['JavaScript']
"Extrayendo Tablas Financieras: Acciones, ETFs y Datos de Mercado","Los sitios financieros son minas de oro de datos tabulares. Precios de acciones, tenencias de ETFs,...",datascience,"['Precios', 'ETFs']"
Building Scalable Node.js APIs with Express: Assembling Your API Like The Avengers,"The Quest Begins (The ""Why"")   I still remember the first time I tried to ship a Node.js API...",frontend,"['The Quest Begins', 'The ""Why', 'the first time I']"
Điều gì xảy ra với OneDrive khi hủy Microsoft 365?,Are you looking into điều gì xảy ra với onedrive khi hủy microsoft 365?? Here's a quick overview of...,cloud,"[""Here's"", 'Are you looking into điều gì xảy ra với onedrive khi hủy microsoft 365?']"
"Building with FastAPI: A Production Journey (Real Code, Real Lessons)","Building with FastAPI: A Production Journey (Real Code, Real Lessons)   How I built...",backend,"['Real Code', 'Building with FastAPI', 'Real Lessons', 'How I', 'A Production Journey']"
US Data Analyst Resume from Chinese University: Structure Guide,"Learn how to structure a data analyst resume for US jobs after graduating from a Chinese university. Includes before/after bullet rewrites, ATS-friendly formatting tips, and a FAQ section.",datascience,"['Includes', 'section', 'Chinese university', 'ATS-friendly', 'US', 'jobs after']"
Building a Shared Capability Layer: Why Your Fifth App Shouldn't Reimplement Email,"You know the moment. You're three weeks into a new app, and it needs to send a password reset...",backend,"['and it needs to send', 'You know the moment', ""You're three weeks"", 'password']"
Sleep-stage detection is mostly inference. Be honest about it.,Sleep-stage classification is where a lot of consumer sleep tech quietly cheats. A quick tour of the...,datascience,['A quick tour of the...']
Day 156 of Learning MERN Stack,"Hello Dev Community! 👋  It is officially Day 156 of my software engineering track! Today, I...",frontend,"['It is officially Day', 'Hello Dev Community', 'Today']"
Right-Sizing Kubernetes Resource Requests Without Outages,Learn how to right-size Kubernetes requests and limits to optimize performance without triggering outages.,cloud,['without triggering outages']
HPA vs VPA vs KEDA: Which Kubernetes Autoscaler Actually Cuts Your Cloud Bill,"Autoscaling is supposed to save money. A lot of the time it doesn't, because people reach for the...",cloud,"[""A lot of the time it doesn't"", 'people reach', 'Autoscaling is']"
Google custom search api free limit: How to bypass the cap,Running out of API quota in the middle of a production deployment is a frustrating rite of passage....,cloud,"['frustrating rite of passage', 'Running out of API quota in the middle of a production deployment is']"
Achieve smooth UI/UX with Unified Components Across Web and Mobile,"Discover how a single API for components can ensure visual and functional consistency across web and native platforms, eliminating duplicated effort and fragmen",frontend,[]
Datadog Adopts Claude & Cursor; Cloudflare Boosts AI Worker Deployment; GPU Chaos Engineering Insights,Datadog Adopts Claude &amp; Cursor; Cloudflare Boosts AI Worker Deployment; GPU Chaos...,cloud,"['GPU Chaos', 'Cloudflare Boosts', 'Datadog Adopts Claude &amp', 'AI Worker Deployment', 'Cursor']"
Serving Real-Time Forex Rates Without Hammering Your API: A FastAPI + MongoDB Caching Strategy,"Any app that serves live data — currency rates, crypto prices, stock tickers, weather — eventually...",frontend,"['weather', 'stock tickers']"
Neighborhood-by-Neighborhood: Comparing Real Estate Markets with Redfin Data,"Compare neighborhoods side-by-side using Redfin data. Analyze pricing, DOM, property types, trends across multiple areas.",datascience,"['Analyze', 'Compare', 'DOM', 'Redfin']"
Membangun Product Configurator Seragam di Frontend: Pricing Rules dan Preview Real-Time,Selama enam bulan terakhir saya mengerjakan satu fitur yang awalnya saya kira sederhana: form...,frontend,"['satu fitur yang awalnya saya kira sederhana', 'Selama']"
🚀 Announcing Breeze: The Go HTTP Framework That Redefines Raw Speed,630k req/s. Zero allocations. Built-in SPA engine. This is Breeze.     Let me skip the humble intro....,backend,"['Zero', 'This is Breeze', 'Let me skip the humble intro', 'Built-in SPA']"
Idempotent Verify Email APIs in PostgreSQL,"How to make verify-email APIs idempotent with PostgreSQL, outbox dedupe, and cleaner inbox assertions for backend teams.",backend,"['PostgreSQL', 'How to make', 'APIs', 'outbox dedupe']"
Your Go API Is Running—But Is It Healthy?,A Go server can start successfully and still be unable to handle real requests.  The process may be...,backend,"['The process may be...', 'and still be unable to handle real requests']"
"Technical SEO for Developers: Building Faster, Crawlable, and Search-Friendly Websites","Technical SEO for Developers: Building Websites That Search Engines Can Crawl, Understand, and...",frontend,"['Understand', 'Technical SEO for Developers: Building Websites That Search Engines Can Crawl']"
Setting up a React Environment,"To use React in production, you need npm which is included with Node.js.  Also, you need to set up a...",frontend,"['To use React in production', 'Also', 'included with Node.js']"
Your P99 Latency Has a Suspicious 40ms Floor. Two 1980s Algorithms Are Arguing.,"The problem   A service I worked on had a weird latency signature: P50 was fine, ~4ms. P99...",backend,"['~4ms', 'P99', 'P50']"
Building PWAs: Offline-First Web Apps Like a Jedi,"The Quest Begins (The ""Why"")   Ever opened a web app on a spotty train ride and watched it...",frontend,"['The Quest Begins', 'train ride and watched it', 'The ""Why']"
10 Side Projects for $13/month: A Tour of PocketBase Cloud,Every indie developer I know has the same problem. It's not ideas. It's not code. It's the $10/month...,backend,"['Every', ""It's the"", ""It's"", 'the same problem']"
10 Real Advantages of a Dedicated Server (With the Numbers Behind Them),"Every hosting provider claims their infrastructure delivers performance, reliability, and security....",cloud,['Every hosting provider claims their infrastructure delivers performance']
How Vector Databases Search a Million Vectors Without Checking a Million,"Take the word ""king."" Your database does not store the word. It stores a vector: a list of 768...",backend,"['It stores', 'king', 'Take the word', 'not store the word', 'list of 768', 'Your']"
Stop Prop Drilling: Architecting React Context ⚡,"The Prop Drilling Nightmare  When engineering complex component trees at Smart Tech Devs, data must...",frontend,"['The Prop Drilling Nightmare  When', 'Smart Tech Devs']"
Spring Boot Validation: Don't Reinvent the Wheel,You're building a new API endpoint and need to validate incoming request data. Most of us grab a...,backend,"['Most of us', 'need to validate incoming']"
ACID em Bancos de Dados: O Que É e Por Que Deveria Importar Para Você,"Entenda as 4 propriedades fundamentais (Atomicity, Consistency, Isolation, Durability) que garantem a confiabilidade dos seus dados e aprenda qual banco escolher.",backend,"['Isolation', 'Entenda', 'Atomicity', 'Consistency', 'Durability']"
"SEC Form 4 insider buying, 2026-07-17: the notable director & officer purchases","Every insider buy and sell reported to the SEC on 2026-07-17, parsed from primary EDGAR filings into...",datascience,"['from primary EDGAR', 'Every insider buy and sell reported to the SEC on 2026-07-17']"
Your Pipeline Is 12.5h Behind: Catching Innovation Sentiment Leads with Pulsebit,Your Pipeline Is 12.5h Behind: Catching Innovation Sentiment Leads with Pulsebit   We just...,datascience,"['Catching Innovation Sentiment Leads with Pulsebit', 'Your Pipeline Is 12.5h Behind', 'We just']"
David Stark: Top High-Paying Roles,"👋 Hello Architects &amp; Elite Engineers,   The market is shifting. We are seeing a surge in...",datascience,"['👋 Hello Architects &amp', 'Elite Engineers', 'We are seeing', 'The market is shifting']"
Four things I would check first with NestJS if a bank's API kept leaking sensitive data,A bank's API rarely leaks sensitive data on purpose. Nobody writes a line of code that says send the...,backend,"['line of code that says send the', 'Nobody']"
How to Hide or UnHide Columns or Rows in Microsoft Excel?,** How to Hide (and Unhide) Columns in Excel Without Losing Your Mind**  We've all been there: a...,datascience,"[""We've all been there"", 'Columns in Excel Without Losing Your Mind', 'How to Hide']"
Senior AI & Python Developer (US-Based Only),Senior AI &amp; Python Developer (US-Based Only)  We are looking for a highly skilled AI &amp; Python...,cloud,"['highly', 'AI &amp', 'Python', 'Python Developer', 'US-Based Only', 'We are looking for a']"
"Claude Code token costs exposed, Grok CLI data analyzed, WordPress 7.0 AI core","Claude Code token costs exposed, Grok CLI data analyzed, WordPress 7.0 AI core           ...",cloud,"['Grok', 'Claude Code', 'WordPress']"
My Frontend learning journey: Building clones with HTML and CSS,I started my web development journey by learning HTML and CSS. Right now I'm moving into Javascript...,frontend,"['Javascript', 'journey by learning HTML and CSS', ""Right now I'm""]"
Your Pipeline Is 21.5h Behind: Catching World Sentiment Leads with Pulsebit,Your pipeline just missed a significant anomaly: a 24h momentum spike of +0.964. This spike indicates...,datascience,"['This spike', 'Your', 'spike of +0.964']"
Why High-Quality Industrial Data Is the Foundation of Smarter Emissions Monitoring,Why High-Quality Industrial Data Is the Foundation of Smarter Emissions...,datascience,['Why High-Quality Industrial Data Is the Foundation of Smarter Emissions']
I added Charts to FrameUI 1.0.0,FrameUI now has charts.  That is the main thing I wanted to add with the new release.  FrameUI...,frontend,"['That is the main thing I wanted to add with the new release', 'FrameUI']"
Why I Stopped Writing tap() Inside rxResource Streams,There's a pattern I see a lot in Angular codebases that adopted Signals early: a developer discovers...,frontend,"['Signals', 'developer discovers']"
"The Matrix: Building Real-Time Chat, Notifications, and Live Updates with WebSockets","The Quest Begins (The ""Why"")   Honestly, I used to think real‑time features were something...",frontend,"['Honestly', 'The Quest Begins', 'real‑time features were something', 'The ""Why']"
"How to Scrape Airbnb Market Data (Prices, Ratings, Availability) at Scale","If you do short-term-rental analysis, competitive pricing, or property research, you eventually need...",datascience,['If you do short-term-rental analysis']
Ever seen a liquid cursor in action?,I vibecoded a cool ui animation for a custom cursor - Liquid Cursor  If you want to see it in action...,frontend,"['If you want to see it in action', 'Liquid Cursor', 'custom', 'cool ui animation for']"
Scrape Eventbrite events without a headless browser,Eventbrite has no free public API for searching events any more. The usual reaction is to reach for...,datascience,"['Eventbrite', 'The usual reaction is to reach for']"
GeekNews Frontend Weekly Deep Dive - 2026-07-20,GeekNews 프론트엔드 이슈를 바탕으로 작성한 주간 브리핑,frontend,"['브리핑', 'GeekNews']"
"OpenAI GPT-Live Voice, Open-Source Chatto, & GitHub AI Agent Security","OpenAI GPT-Live Voice, Open-Source Chatto, &amp; GitHub AI Agent Security            Today's...",cloud,"['Open-Source Chatto', ""GitHub AI Agent Security            Today's"", 'OpenAI GPT-Live Voice']"
Your Pipeline Is 15.9h Behind: Catching Healthcare Sentiment Leads with Pulsebit,Your Pipeline Is 15.9h Behind: Catching Healthcare Sentiment Leads with Pulsebit   We just...,datascience,"['We just', 'Catching Healthcare Sentiment Leads with Pulsebit', 'Your Pipeline Is']"
copilot browser tools make the frontend reviewable,GitHub Copilot browser tools in VS Code are generally available. The useful part is not that agents can click buttons; it is that frontend work can start producing evidence reviewers can inspect.,frontend,"['Code are generally available', 'GitHub Copilot', 'it is that frontend work can start producing evidence reviewers can inspect', 'The useful part is not that agents can click buttons']"
"Claude Cowork Expands, AWS AI DevOps Agent, HubSpot Scales Semantic Search","Claude Cowork Expands, AWS AI DevOps Agent, HubSpot Scales Semantic Search           ...",cloud,"['AI DevOps Agent', 'AWS', 'HubSpot Scales Semantic Search', 'Claude Cowork Expands']"
DORA Metrics Measure Delivery Health. What Measures Security Posture Health?,"Delivery teams have five metrics that predict outcomes. Security teams have finding counts and compliance percentages. The same five metrics, applied to posture, tell you whether your cloud is getting safer or just getting scanned.",cloud,"['The same five metrics', 'five metrics that predict outcomes', 'Security teams', 'tell you whether your cloud is getting safer or just getting scanned', 'applied to posture']"
"openFDA Adverse Event API: Paging Past 25,000 and Flattening","Measured guide to the openFDA adverse event API: beat the 25,000 skip cap with search_after, fix silent overcounts, decode code fields, flatten FAERS and MAUDE.",datascience,"['silent overcounts', 'Measured guide to the openFDA', 'with search_after', 'FAERS and MAUDE', 'decode code fields']"
Synchronous vs Asynchronous Workloads: Why Modern Systems Cannot Afford To Wait,The Illusion of Simplicity   Most software begins with a simple interaction.  A user clicks...,backend,['The Illusion of Simplicity   Most']
Gói pCloud Lifetime Có Đáng Mua Năm 2026? Phân Tích Chi Phí & Lợi Ích,Are you looking into gói pcloud lifetime có đáng mua năm 2026? phân tíc? Here's a quick overview of...,cloud,"['Are you looking into gói pcloud lifetime có đáng', ""Here's"", 'quick overview of']"
From http.ServeMux to Dependency Injection in Go: A Beginner-Friendly Guide,"When I first saw code like this, it felt as if too many things were happening in one...",backend,"['were happening in one', 'When I']"
Scaling Terraform Infrastructure Beyond a Single Team,"When a single engineer manages all the Terraform in an organisation, everything is simple. One repo,...",cloud,['One repo']
Docker Build Emails Need Run IDs in AWS,A practical AWS and Docker workflow for validating build emails with isolated inboxes and traceable run IDs.,cloud,"['IDs', 'emails with isolated']"
Copilot Vision Accepts Screenshots—Now Test Whether the Workflow Still Works Without Sight or a Mouse,"Audit screenshot-assisted coding with an accessible text alternative, keyboard flow, announcements, and recovery matrix.",frontend,"['Audit', 'with an accessible text alternative', 'recovery matrix']"
Building a Population Health Risk Stratification Pipeline for MA Plans,Risk stratification sounds like a data-science buzzword until you have to build the thing. For a...,datascience,"['Risk', 'data-science buzzword']"
"Debugging Stalled Jobs in BullMQ: What Actually Causes Them and How to Catch Them Early published: false tags: node, redis, bullmq, backend","If you've run BullMQ in production long enough, you've probably seen a job go ""stalled"" — and if you...",backend,['BullMQ']
useOptimistic in React 19: Patterns and Pitfalls from Real Forms,Headline: React 19's useOptimistic shows the result of an action before the server confirms it. The...,frontend,"['Headline', 'the result of an action before the server confirms it.', 'useOptimistic', 'React']"
Why Thomas Tuchel: ‘Argentina will be fuelled by history – but we are ready’ Matters for Sports Data Engineers,Why Thomas Tuchel: ‘Argentina will be fuelled by history – but we are ready’ Matters for...,datascience,"['Why Thomas Tuchel: ‘', 'will be fuelled by history – but we are ready’ Matters for']"
HTML Forms and Their Elements,HTML Forms and Common Form Tags   HTML forms are used to collect information from users...,frontend,"['HTML Forms and Common Form Tags   HTML', 'collect information from users']"
Why I Still Test In Safari First (And The Bugs It Catches Early),"Yes, I Still Open Safari First  I build and test new frontend work in Safari first. On purpose....",frontend,"['On', 'I Still Open Safari First  I', 'work in Safari']"
Using AI to Add Business Context to Cloud Security,A critical vulnerability on an Alpine-based reverse proxy sitting behind three layers of network...,cloud,['sitting behind']
Why JavaScript Matters More Than Any Framework,"Frameworks are tools, not foundations   Frameworks exist to tame complexity, but they stand...",frontend,"['Frameworks are tools', 'but they stand', 'Frameworks']"
Day 119 of Learning MERN Stack,"Hello Dev Community! 👋  It is officially Day 119 of my software engineering marathon! Today, I...",frontend,"['Hello Dev Community', 'It is officially Day 119 of my software engineering marathon! Today']"
Quantifying the Unquantifiable: Using AI to Turn Everything into a Metric,"We love metrics. But as developers, we often struggle to measure abstract concepts like code...",datascience,"['like code', 'We love metrics', 'But as developers', 'struggle to measure']"
Every New API Is Another Promise You'll Have to Keep,Developers love APIs.  They save time.  They unlock new features.  They help products grow...,backend,"['They unlock', 'They help products grow', 'They save time', 'APIs']"
Your Pipeline Is 25.2h Behind: Catching Travel Sentiment Leads with Pulsebit,Your Pipeline Is 25.2h Behind: Catching Travel Sentiment Leads with Pulsebit   We just...,datascience,"['Travel Sentiment Leads with Pulsebit', 'We just', 'Your Pipeline Is 25.2h Behind']"
"How I Kept a Live Chat Feed Smooth at 3,700+ Messages","I built LiveShop, a mini live-shopping stream UI, to answer a question I kept running into as a...",frontend,"['LiveShop', 'UI']"
Why Your Payment Calculations Break at Scale (And How to Fix It),"If you’ve ever worked with payments in your app, you’ve probably done something like this:  const fee...",backend,"['you’ve', 'you’ve probably done something']"
"Turn any photo into a CSS color palette (image to HEX, RGB & OKLCH)","Designers hand you a mood photo — a sunset, a product shot, a piece of packaging — and say ""use these...",frontend,['Designers']
How Netflix Architecture Handles 300+ Million Users (A Deep Dive),I spent the last few days digging into Netflix's backend architecture — from a YouTube deep-dive to...,backend,"['YouTube', ""Netflix's backend architecture"", 'I spent the last few days']"
Claude Code's Auto Mode Now Default on Major Cloud Platforms,"Anthropic's latest release makes autonomous coding the default on major cloud platforms, shifting the governance landscape for enterprise teams.",cloud,"['shifting the governance landscape', ""Anthropic's latest""]"
How to Replace Legacy Reporting Tools with Light REST APIs (And Save Infrastructure Costs),"If you have ever worked on enterprise applications, ERPs, or legacy software, you probably know...",cloud,"['ERPs', 'If']"
The Hidden Cost of Every npm install: Why 2026 Is the Year We Stop Patching JavaScript,"Lifecycle: library adoption (2010–2020), platform parity (2021–2024), and dependency deletion...",frontend,"['Lifecycle: library adoption', 'platform parity']"
Day 111 of Learning MERN Stack,"Hello Dev Community! 👋  It is officially Day 111 of my software engineering marathon! Today, I...",frontend,"['It is officially Day 111 of my software engineering marathon! Today', 'Hello Dev Community']"
AI Video Needs CI More Than Better Prompts,"Here I'll share what I built for Track 2 of the Global AI Hackathon Series with Qwen Cloud, and what...",cloud,['Track 2 of the Global AI Hackathon Series with Qwen Cloud']
